<?xml version="1.0" encoding="UTF-8"?>
<!--
To change this license header, choose License Headers in Project Properties.
To change this template file, choose Tools | Templates
and open the template in the editor.
-->

<!DOCTYPE order SYSTEM 'bonanza.dtd'>

<order type="takeout">
    <customer>Justin</customer>
    <burger>
        <patty type="bison"/>
        <cheese top="gouda" bottom="brie"/>
        <topping type="bacon"/>
        <topping type="avacado"/>
        <topping type="lettuce"/>
        <sauce type="ketchup"/>
        <sauce type="mayo"/>
        <instructions>smear peanut butter on the inside of each bun</instructions>
    </burger>
    <burger>
        <patty type="turkey"/>
        <cheese top="goat" bottom="jack"/>
        <topping type="fkchili"/>
        <topping type="avacado"/>
        <topping type="lettuce"/>
        <topping type="dill"/>
        <topping type="raw"/>
        <sauce type="fksauce"/>
        <sauce type="mustard"/>
        <instructions>douse in maple syrup</instructions>
    </burger>
</order>
